title,company,location,tags,date,url
Events and Administrative Associate,GiveDirectly,Nairobi,"software, financial, management, operations",2025-11-11T05:00:14+00:00,https://remoteOK.com/remote-jobs/remote-events-and-administrative-associate-givedirectly-1128917
Content Producer,garden3d,,"marketing, design, exec, content writing, video, ads",2025-11-10T17:10:26+00:00,https://remoteOK.com/remote-jobs/remote-content-producer-garden3d-1128916
Account Executive $215K OTE,Stealth Startup,,sales,2025-11-10T10:26:03+00:00,https://remoteOK.com/remote-jobs/remote-account-executive-215k-ote-stealth-startup-1128913
Intern CPR Awareness & Project Management,Jobgether,,"students, training, support, management, content, operational, marketing, legal, health, recruitment, internship, non tech",2025-11-10T08:00:38+00:00,https://remoteOK.com/remote-jobs/remote-intern-cpr-awareness-project-management-jobgether-1128911
Current openings,Paystack,Nigeria,bank,2025-11-09T21:00:42+00:00,https://remoteOK.com/remote-jobs/remote-current-openings-paystack-1128910
Current openings,Hone Health,Remote,"excel, medical, health, healthcare, non tech",2025-11-09T21:00:23+00:00,https://remoteOK.com/remote-jobs/remote-current-openings-hone-health-1128909
Current openings,Carrot,Remote,,2025-11-09T20:00:06+00:00,https://remoteOK.com/remote-jobs/remote-current-openings-carrot-1128908
COBOL Specialist AI Trainer,Invisible Agency,World Wide,"trainer, training, cobol",2025-11-09T18:00:11+00:00,https://remoteOK.com/remote-jobs/remote-cobol-specialist-ai-trainer-invisible-agency-1128907
Content Strategist,Capgemini,Chennai,"design, training, strategist, support, testing, financial, microsoft, leader, strategy, management, content, operations, health, engineering, digital nomad",2025-11-09T16:00:53+00:00,https://remoteOK.com/remote-jobs/remote-content-strategist-capgemini-1128906
Bookkeeper & Budget Analyst,Offshore Launch,Remote,analyst,2025-11-09T15:00:12+00:00,https://remoteOK.com/remote-jobs/remote-bookkeeper-budget-analyst-offshore-launch-1128905
Principal Backend Engineer,Medium,Remote - US,"engineer, backend",2025-11-09T10:00:07+00:00,https://remoteOK.com/remote-jobs/remote-principal-backend-engineer-medium-1128904
KIP Spring 2026 Global Projects Intern Young Voices,Stand Together,"Washington, DC","training, internship, full-time, part-time",2025-11-08T17:00:01+00:00,https://remoteOK.com/remote-jobs/remote-kip-spring-2026-global-projects-intern-young-voices-stand-together-1128903
Firmware HIL Engineer,Applied Intuition,Mountain View,engineer,2025-11-07T16:00:36+00:00,https://remoteOK.com/remote-jobs/remote-firmware-hil-engineer-applied-intuition-1128899
Senior Product Designer,Nansen.ai,"Remote Europe, Remote Asia","design, crypto, system, designer, testing, senior, analytics, digital nomad",2025-11-07T13:00:30+00:00,https://remoteOK.com/remote-jobs/remote-senior-product-designer-nansen-ai-1128898
UX Researcher Mixed Methods,Linda Werner & Associates,Menlo Park,"ux, design, testing, seo, lead, senior, digital nomad",2025-11-07T00:02:46+00:00,https://remoteOK.com/remote-jobs/remote-ux-researcher-mixed-methods-linda-werner-associates-1128897
Quality Assurance Analyst II,Filevine,United States,"analyst, software, testing, test, qa, api, junior, legal, full-time",2025-11-07T00:02:24+00:00,https://remoteOK.com/remote-jobs/remote-quality-assurance-analyst-ii-filevine-1128896
Brand Designer,Sage,New York,"design, system, designer, software, web, senior, digital nomad",2025-11-07T00:02:17+00:00,https://remoteOK.com/remote-jobs/remote-brand-designer-sage-1128895
Senior Javascript Fullstack Engineer,Filevine,United States,"design, system, technical, web, javascript, api, senior, legal, engineer, engineering, fullstack, full-time, digital nomad",2025-11-07T00:01:58+00:00,https://remoteOK.com/remote-jobs/remote-senior-javascript-fullstack-engineer-filevine-1128894
Assoc Protocol Engineer,Galaxy Digital Services,US,"web3, crypto, founder, ceo, software, devops, investment, finance, perl, leader, engineer, engineering",2025-11-07T00:01:51+00:00,https://remoteOK.com/remote-jobs/remote-assoc-protocol-engineer-galaxy-digital-services-1128893
Senior Manager Field Operations,Corcept Therapeutics,Remote,"manager, leader, lead, senior, operations, operational, sales, executive, non tech",2025-11-07T00:01:26+00:00,https://remoteOK.com/remote-jobs/remote-senior-manager-field-operations-corcept-therapeutics-1128892
Senior Data Analyst Supply Chain,Spreetail,Remote,"analyst, senior, operational, analytics, ecommerce",2025-11-07T00:01:07+00:00,https://remoteOK.com/remote-jobs/remote-senior-data-analyst-supply-chain-spreetail-1128891
Product Manager,Crux,,"manager, design, system, support, strategy, engineering, digital nomad",2025-11-07T00:00:44+00:00,https://remoteOK.com/remote-jobs/remote-product-manager-crux-1128890
Backend Engineer,Raya,Los Angeles or Remote,"elasticsearch, engineer, engineering, backend",2025-11-07T00:00:38+00:00,https://remoteOK.com/remote-jobs/remote-backend-engineer-raya-1128889
Executive Assistant & Customer Service Support A089,Pearl,,"assistant, support, software, growth, operations, operational, reliability, health, recruiting, recruitment, executive, full-time",2025-11-07T00:00:30+00:00,https://remoteOK.com/remote-jobs/remote-executive-assistant-customer-service-support-a089-pearl-1128888
,,,"design, digital nomad",2025-11-06T22:00:00+00:00,https://remoteOK.com/remote-jobs/remote-1128887
Quantitative Research Intern,Detroit Lions,Detroit,"game, lead, analytics, educational, internship",2025-11-06T18:00:15+00:00,https://remoteOK.com/remote-jobs/remote-quantitative-research-intern-detroit-lions-1128886
Software Engineer,Jump,,"engineer, AI, backend, front end, full stack, dev, saas",2025-11-06T17:07:37+00:00,https://remoteOK.com/remote-jobs/remote-software-engineer-jump-1128885
Technical Channels Specialist,Spreetail,Manila,"osx, system, technical, support, microsoft, operational, recruitment, ecommerce",2025-11-06T16:00:23+00:00,https://remoteOK.com/remote-jobs/remote-technical-channels-specialist-spreetail-1128884
Growth Marketing Manager,InfStones,Texas,"growth, manager, web3, node, mobile, management, marketing, analytics, sales, full-time",2025-11-06T09:00:01+00:00,https://remoteOK.com/remote-jobs/remote-growth-marketing-manager-infstones-1128883
Associate US Market Access,Avalere Health ,Washington DC,"design, training, consulting, support, growth, manager, microsoft, content, marketing, excel, medical, health, healthcare, full-time, digital nomad",2025-11-06T08:01:51+00:00,https://remoteOK.com/remote-jobs/remote-associate-us-market-access-avalere-health-1128882
Manager Account Executives,OpenTable,Manila,"manager, training, growth, director, travel, leader, management, lead, senior, sales",2025-11-06T08:01:44+00:00,https://remoteOK.com/remote-jobs/remote-manager-account-executives-opentable-1128881
Associate Principal Principal US Market Access,Avalere Health ,,"training, support, growth, management, lead, senior, junior, marketing, medical, health, healthcare",2025-11-06T08:01:09+00:00,https://remoteOK.com/remote-jobs/remote-associate-principal-principal-us-market-access-avalere-health-1128880
Market Researcher Product Marketing,OpenAI,,"design, security, strategy, lead, marketing, excel, analytics, digital nomad",2025-11-06T00:01:41+00:00,https://remoteOK.com/remote-jobs/remote-market-researcher-product-marketing-openai-1128879
Data Engineer,Sagent,Remote,"design, cloud, engineer, digital nomad",2025-11-06T00:01:34+00:00,https://remoteOK.com/remote-jobs/remote-data-engineer-sagent-1128878
Fullstack Software Engineer,ARB Interactive,Miami,"software, design, react, front-end, frontend, security, game, gaming, code, web, qa, banking, serverless, cloud, lead, recruiting, engineer, engineering, recruitment, backend, fullstack, digital nomad",2025-11-06T00:01:17+00:00,https://remoteOK.com/remote-jobs/remote-fullstack-software-engineer-arb-interactive-1128877
Data Engineer,Loop,,"python, growth, code, cloud, senior, operations, analytics, engineer",2025-11-06T00:01:10+00:00,https://remoteOK.com/remote-jobs/remote-data-engineer-loop-1128876
Director Pharma Activation Success,NimbleRx,Remote,"director, support, voice, investment, management, lead, operations, marketing, sales, health, healthcare, non tech",2025-11-06T00:00:54+00:00,https://remoteOK.com/remote-jobs/remote-director-pharma-activation-success-nimblerx-1128875
Director of Payments U.S. Canada,Banyan Software,Toronto,"dev, director, design, embedded, software, growth, financial, finance, fintech, strategy, management, lead, legal, digital nomad",2025-11-06T00:00:35+00:00,https://remoteOK.com/remote-jobs/remote-director-of-payments-u-s-canada-banyan-software-1128873
Senior Environment Concept Artist Contract,ArenaNet,Remote,"design, vfx, game, support, developer, lead, senior, photoshop, digital nomad",2025-11-05T20:01:11+00:00,https://remoteOK.com/remote-jobs/remote-senior-environment-concept-artist-contract-arenanet-1128872
Senior Creature Concept Artist Contract,ArenaNet,Remote,"design, game, developer, lead, senior, photoshop, digital nomad",2025-11-05T20:00:49+00:00,https://remoteOK.com/remote-jobs/remote-senior-creature-concept-artist-contract-arenanet-1128871
Senior Concept Artist Contract,ArenaNet,Remote,"game, support, developer, lead, senior, photoshop, digital nomad",2025-11-05T20:00:21+00:00,https://remoteOK.com/remote-jobs/remote-senior-concept-artist-contract-arenanet-1128870
Senior Software Engineer,Stellar AI,,"dev, train",2025-11-05T17:11:36+00:00,https://remoteOK.com/remote-jobs/remote-senior-software-engineer-stellar-ai-1128869
Social Media Manager,Highsnobiety,Berlin,"manager, design, support, travel, video, management, content, digital nomad",2025-11-05T16:04:21+00:00,https://remoteOK.com/remote-jobs/remote-social-media-manager-highsnobiety-1128868
Senior Recruitment Business Partner Commercial,Adyen,Amsterdam,"technical, recruiter, support, growth, financial, microsoft, senior, analytics, recruiting, recruitment",2025-11-05T16:03:52+00:00,https://remoteOK.com/remote-jobs/remote-senior-recruitment-business-partner-commercial-adyen-1128867
Business Unit Control Manager,Chime,San Francisco,"manager, support, test, qa, strategy, management, full-time",2025-11-05T16:03:22+00:00,https://remoteOK.com/remote-jobs/remote-business-unit-control-manager-chime-1128866
Business Analyst R01557177,Brillio,"Toronto, Ontario, Canada","analyst, design, system, consultant, testing, test, strategy, management, analytics, digital nomad",2025-11-05T16:02:58+00:00,https://remoteOK.com/remote-jobs/remote-business-analyst-r01557177-brillio-1128865
Software Engineer II Merchant Operational Excellence,Adyen,Amsterdam,"software, technical, support, web, manager, financial, java, microsoft, strategy, operations, operational, engineer",2025-11-05T16:02:51+00:00,https://remoteOK.com/remote-jobs/remote-software-engineer-ii-merchant-operational-excellence-adyen-1128864
Senior Data Engineer Reporting,Adyen,Bengaluru,"design, technical, support, software, code, financial, microsoft, senior, excel, engineer, engineering, digital nomad",2025-11-05T16:02:25+00:00,https://remoteOK.com/remote-jobs/remote-senior-data-engineer-reporting-adyen-1128863
Senior Software Engineer Checkout,Adyen,Amsterdam,"software, technical, support, web, financial, api, microsoft, senior, engineer",2025-11-05T16:01:54+00:00,https://remoteOK.com/remote-jobs/remote-senior-software-engineer-checkout-adyen-1128862
Solutions Architect,Adyen,Madrid,"architect, consulting, technical, support, web, financial, management, engineer, engineering, e-commerce",2025-11-05T16:01:18+00:00,https://remoteOK.com/remote-jobs/remote-solutions-architect-adyen-1128861
BCBA Up 75,Circle Care Services,"Silver Spring, MD","lead, legal, full-time, part-time, non tech",2025-11-05T16:00:50+00:00,https://remoteOK.com/remote-jobs/remote-bcba-up-75-circle-care-services-1128860
Job Opening Orion Innovation,Orion Innovation,Remote,"software, c++",2025-11-05T16:00:42+00:00,https://remoteOK.com/remote-jobs/remote-job-opening-orion-innovation-orion-innovation-1128859
Mid level Full Stack Engineer HRPS PK,Smart Working Solutions,,"design, hr, system, front-end, back-end, full-stack, technical, support, developer, software, testing, growth, ux, code, payroll, devops, reliability, engineer, engineering, backend, digital nomad",2025-11-05T16:00:26+00:00,https://remoteOK.com/remote-jobs/remote-mid-level-full-stack-engineer-hrps-pk-smart-working-solutions-1128858
Director Security Engineering,Jobgether,,"security, director, technical, code, web, cloud, strategy, lead, operations, engineering",2025-11-05T16:00:19+00:00,https://remoteOK.com/remote-jobs/remote-director-security-engineering-jobgether-1128857
Distribution Designer,Jobgether,,"design, designer, technical, support, management, engineering, digital nomad",2025-11-05T16:00:13+00:00,https://remoteOK.com/remote-jobs/remote-distribution-designer-jobgether-1128856
Senior Manager Marketing Compliance,Chime,"San Francisco, CA","manager, leader, strategy, lead, senior, marketing, full-time, non tech",2025-11-05T00:10:08+00:00,https://remoteOK.com/remote-jobs/remote-senior-manager-marketing-compliance-chime-1128855
Marketing Operations Strategist,Power Digital,Remote - Argentina,"consulting, strategist, testing, growth, investment, content, operations, marketing",2025-11-05T00:09:47+00:00,https://remoteOK.com/remote-jobs/remote-marketing-operations-strategist-power-digital-1128854
Marketing Operations Strategist,Power Digital,Costa Rica,"consulting, strategist, testing, growth, investment, content, operations, marketing",2025-11-05T00:09:28+00:00,https://remoteOK.com/remote-jobs/remote-marketing-operations-strategist-power-digital-1128853
API Security Engineer,Salt Security,San Francisco,"infosec, security, api, engineer",2025-11-05T00:08:59+00:00,https://remoteOK.com/remote-jobs/remote-api-security-engineer-salt-security-1128852
Junior Technical Operations Engineer,LetsGetChecked,Remote,"security, technical, growth, cloud, junior, operations, health, healthcare, engineer",2025-11-05T00:08:45+00:00,https://remoteOK.com/remote-jobs/remote-junior-technical-operations-engineer-letsgetchecked-1128851
Key Account Manager Louisville KY,Braeburn,"Louisville, KY","manager, management, sales, healthcare, non tech",2025-11-05T00:08:29+00:00,https://remoteOK.com/remote-jobs/remote-key-account-manager-louisville-ky-braeburn-1128850
Account Manager,ParetoHealth,Kansas City area,"manager, lead, health, non tech",2025-11-05T00:08:04+00:00,https://remoteOK.com/remote-jobs/remote-account-manager-paretohealth-1128849
Regional VP AL TN,Protective,Work From Home,"support, financial, bank, leader, management, senior, sales, health, healthcare, recruitment, non tech",2025-11-05T00:07:36+00:00,https://remoteOK.com/remote-jobs/remote-regional-vp-al-tn-protective-1128848
Project Manager Design Build Construction,Foth,"Green Bay, Wisconsin","design, manager, consulting, support, testing, growth, travel, leader, management, lead, recruiting, engineer, engineering, full-time, part-time, digital nomad",2025-11-05T00:07:29+00:00,https://remoteOK.com/remote-jobs/remote-project-manager-design-build-construction-foth-1128847
EMEA Sales Development Representative,AppFollow,Europe,"software, growth, lead, marketing, sales",2025-11-05T00:07:21+00:00,https://remoteOK.com/remote-jobs/remote-emea-sales-development-representative-appfollow-1128846
Regional Sales Manager South East,JuneShine Brands,"Tampa, FL","manager, growth, travel, leader, strategy, management, lead, marketing, sales, go",2025-11-05T00:07:14+00:00,https://remoteOK.com/remote-jobs/remote-regional-sales-manager-south-east-juneshine-brands-1128845
SEO Specialist,QuillBot,India,"design, students, technical, growth, web, javascript, seo, strategy, content, marketing, engineering, digital nomad",2025-11-05T00:07:05+00:00,https://remoteOK.com/remote-jobs/remote-seo-specialist-quillbot-1128844
Staff Software Engineer Java,Integral Ad Science,Remote,"software, code, java, cloud, junior, engineer",2025-11-05T00:06:46+00:00,https://remoteOK.com/remote-jobs/remote-staff-software-engineer-java-integral-ad-science-1128843
Customer Success Manager,SQUIRE,United States,"manager, saas, system, travel, voice, management, legal, health",2025-11-05T00:06:31+00:00,https://remoteOK.com/remote-jobs/remote-customer-success-manager-squire-1128842
Becker Tax Instructors,Colibri Group,United States,"teach, instructor, teaching, students, support, accounting, education, leader, content, non tech",2025-11-05T00:06:23+00:00,https://remoteOK.com/remote-jobs/remote-becker-tax-instructors-colibri-group-1128841
Frontend Tech Lead,AirDNA,Remote,"frontend, design, react, training, full-stack, technical, support, developer, software, financial, education, investment, api, leader, management, lead, junior, engineer, engineering, backend, digital nomad",2025-11-05T00:06:16+00:00,https://remoteOK.com/remote-jobs/remote-frontend-tech-lead-airdna-1128840
Software Engineer Engineering Productivity,Reliable Robotics,Remote,"software, design, react, system, python, technical, support, test, ux, code, web, travel, cloud, robotics, management, senior, engineer, engineering, digital nomad",2025-11-05T00:06:09+00:00,https://remoteOK.com/remote-jobs/remote-software-engineer-engineering-productivity-reliable-robotics-1128839
Senior Sales Director Corporate & Public Sector,NetDocuments,Remote - US,"director, growth, management, content, senior, legal, sales, recruitment",2025-11-05T00:06:03+00:00,https://remoteOK.com/remote-jobs/remote-senior-sales-director-corporate-public-sector-netdocuments-1128838
Senior Environment Artist Contract,ArenaNet,Remote,"design, vfx, game, support, developer, lead, senior, photoshop, digital nomad",2025-11-05T00:05:37+00:00,https://remoteOK.com/remote-jobs/remote-senior-environment-artist-contract-arenanet-1128837
Senior Manager of Marketing Programs,Lumin Digital,Remote- United States,"manager, saas, technical, financial, fintech, banking, cloud, strategy, management, senior, operations, operational, marketing, analytics, sales",2025-11-05T00:05:14+00:00,https://remoteOK.com/remote-jobs/remote-senior-manager-of-marketing-programs-lumin-digital-1128836
Finance Analyst,H1,New York,"analyst, saas, system, technical, recruiter, support, director, financial, finance, microsoft, operations, excel, sales, biotech, health, healthcare, executive",2025-11-05T00:05:07+00:00,https://remoteOK.com/remote-jobs/remote-finance-analyst-h1-1128835
Senior Data Analyst,TextNow,Open- Canada,"analyst, python, support, growth, travel, senior, junior, operations, analytics, engineering",2025-11-05T00:05:00+00:00,https://remoteOK.com/remote-jobs/remote-senior-data-analyst-textnow-1128834
Senior Cloud Engineer Observability,NetDocuments,Remote - US,"growth, cloud, management, content, senior, legal, engineer, recruitment",2025-11-05T00:04:54+00:00,https://remoteOK.com/remote-jobs/remote-senior-cloud-engineer-observability-netdocuments-1128833
Software Engineer Generalist Devops,Aztec,Global Remote,"software, security, developer, devops, math, lead, engineer, engineering, digital nomad",2025-11-05T00:04:37+00:00,https://remoteOK.com/remote-jobs/remote-software-engineer-generalist-devops-aztec-1128832
Director Global Training and Development,Celerion,Remote - US,"training, director, design, technical, growth, travel, adult, leader, strategy, management, lead, content, analytics, educational, digital nomad",2025-11-05T00:04:13+00:00,https://remoteOK.com/remote-jobs/remote-director-global-training-and-development-celerion-1128831
Principal Product Engineer Digital Twins,Esri,Remote Eligible-US,"3d, strategist, software, ux, engineer",2025-11-05T00:04:07+00:00,https://remoteOK.com/remote-jobs/remote-principal-product-engineer-digital-twins-esri-1128830
Marketing Operations Project Manager,TerrAscend,Remote,"manager, amazon, security, recruiter, support, software, director, adult, financial, microsoft, management, operations, marketing, excel, legal, health, recruiting",2025-11-05T00:03:50+00:00,https://remoteOK.com/remote-jobs/remote-marketing-operations-project-manager-terrascend-1128829
CRM Content Writer EMEA,Medier,Remote,"writer, testing, content, marketing, non tech",2025-11-05T00:03:41+00:00,https://remoteOK.com/remote-jobs/remote-crm-content-writer-emea-medier-1128828
Solutions Architect,Lumin Digital,Remote- United States,"architect, training, technical, travel, financial, banking, cloud, senior, sales",2025-11-05T00:03:23+00:00,https://remoteOK.com/remote-jobs/remote-solutions-architect-lumin-digital-1128827
Channel Account Manager,FireMon,"USA, Remote","manager, security, training, technical, software, growth, management, educational",2025-11-05T00:03:16+00:00,https://remoteOK.com/remote-jobs/remote-channel-account-manager-firemon-1128826
Application Security Engineer,Gensyn,Remote,"security, design, web3, crypto, web, strategy, engineer, digital nomad",2025-11-05T00:03:10+00:00,https://remoteOK.com/remote-jobs/remote-application-security-engineer-gensyn-1128825
EU GO Senior Software Engineer,Connectly,Remote/Greece,"software, system, frontend, python, technical, code, cloud, api, strategy, senior, operational, excel, go, engineer, engineering, backend",2025-11-05T00:02:51+00:00,https://remoteOK.com/remote-jobs/remote-eu-go-senior-software-engineer-connectly-1128824
Product Support Specialist,Flock Safety,,"saas, salesforce, security, technical, recruiter, support, software, management, lead, operations, sales, health, executive",2025-11-05T00:02:45+00:00,https://remoteOK.com/remote-jobs/remote-product-support-specialist-flock-safety-1128823
Customer Service Representative,"Contact Government Services, LLC",,"security, support, growth, web, financial, management, content, educational",2025-11-05T00:02:38+00:00,https://remoteOK.com/remote-jobs/remote-customer-service-representative-contact-government-services-llc-1128822
Account Manager,doola,,"manager, support, growth, voice, financial, management, operational, marketing, sales",2025-11-05T00:02:31+00:00,https://remoteOK.com/remote-jobs/remote-account-manager-doola-1128821
Bitwarden,Bitwarden,Remote,,2025-11-05T00:02:25+00:00,https://remoteOK.com/remote-jobs/remote-bitwarden-bitwarden-1128820
Senior Tax Analyst Galway Holdings,EPIC Brokers,Remote,"analyst, support, growth, senior",2025-11-05T00:02:13+00:00,https://remoteOK.com/remote-jobs/remote-senior-tax-analyst-galway-holdings-epic-brokers-1128819
API Security Engineer,Salt Security,San Francisco,"infosec, security, api, engineer",2025-11-05T00:01:50+00:00,https://remoteOK.com/remote-jobs/remote-api-security-engineer-salt-security-1128818
Account Manager Paid Search,Monks,Remote,"manager, management, marketing, non tech",2025-11-05T00:01:36+00:00,https://remoteOK.com/remote-jobs/remote-account-manager-paid-search-monks-1128817
Enterprise Account Executive NA West,Akuity,Remote - North America,"saas, technical, software, code, devops, sales, engineering, executive, full-time",2025-11-05T00:01:20+00:00,https://remoteOK.com/remote-jobs/remote-enterprise-account-executive-na-west-akuity-1128816
Senior iOS Developer,Web Summit,Barcelona,"ios, developer, web dev, design, swift, architect, ui, ux, web, mobile, senior, excel, engineering, digital nomad",2025-11-05T00:00:56+00:00,https://remoteOK.com/remote-jobs/remote-senior-ios-developer-web-summit-1128815
Program Manager,Digimarc,,"manager, technical, support, software, growth, microsoft, management, excel, health, executive",2025-11-05T00:00:48+00:00,https://remoteOK.com/remote-jobs/remote-program-manager-digimarc-1128814
Exploit Developer,VulnCheck,Cheltenham,"developer, security, technical, software, code, management, lead, senior, engineering, digital nomad",2025-11-04T17:00:20+00:00,https://remoteOK.com/remote-jobs/remote-exploit-developer-vulncheck-1128813
Business Development Representative,Zone & Co,United Kingdom,"saas, software, finance",2025-11-04T16:02:32+00:00,https://remoteOK.com/remote-jobs/remote-business-development-representative-zone-co-1128812
